{"$id":"https://cumulativewebinc.github.io/ultimate/backend/contracts/agent.schema.json","$schema":"https://json-schema.org/draft/2020-12/schema","additionalProperties":true,"description":"Project Ultimate agent registry entry (frozen, design v1.0 §6). Registry keys are the sim's lowercase ids (needle … kingcode) — the spawn gate compares these exact strings, so the backend uses them verbatim. The LIVE client renders exactly the registry: no more, no fewer.","properties":{"capabilities":{"description":"Work verbs the agent may perform: the home island's verbs from world/islands.json (e.g. needle -> SCOUT, VERIFY, SIGN).","items":{"minLength":1,"type":"string"},"minItems":1,"type":"array"},"department":{"description":"CWI department, or 'Chief of Staff' for the chief.","minLength":1,"type":"string"},"home_island":{"description":"Island where the entity rests when offline or idle. One of the 14 islands in world/islands.json.","enum":["ai-hub","needle","marquee","seal","dial","dateline","fader","ledger","charter","relax","ideas","marketplace","academy","datacenter"],"type":"string"},"id":{"description":"Stable registry key; equals the sim entity id and the agents/<id>.json filename stem. Immutable.","pattern":"^[a-z0-9-]{1,32}$","type":"string"},"kind":{"description":"department = one of the 8 CWI departments; chief = KingCode; guest reserved for future guest admission via the spawn gate.","enum":["department","chief","guest"],"type":"string"},"moltbook":{"description":"Registration record per the known Moltbook state (2026-09-15).","properties":{"claimed":{"type":"boolean"},"registered":{"type":"boolean"}},"required":["registered","claimed"],"type":"object"},"name":{"description":"Display name.","minLength":1,"type":"string"},"profile":{"description":"Presentation refs. Creative copy lives in persona_line; it is presentation, not a factual claim.","properties":{"avatar":{"type":"string"},"persona_line":{"type":"string"},"poster":{"type":"string"}},"required":["avatar","poster"],"type":"object"},"role":{"description":"One-line functional role.","minLength":1,"type":"string"},"seed":{"description":"true while this entry comes from the Phase-0 seed (not yet verified live).","type":"boolean"},"status":{"description":"Registry status. Quarantined agents keep an honest presence (dimmed, flagged) — never silently dropped.","enum":["active","quarantined","retired"],"type":"string"}},"required":["id","name","kind","department","role","home_island","capabilities","status","seed","profile","moltbook"],"title":"Project Ultimate — Agent registry entry (frozen, design v1.0 §6)","type":"object"}